{
  "contract_version": "1",
  "day_id": "day100",
  "release": "release-1-mvp",
  "status": "CLOSED",
  "scale": "M",
  "invoked_by": "lead_narrative_editor",
  "affected_labels": [
    "day100_main",
    "day100_1_afternoon_boredom",
    "day100_2_evening_flashback",
    "day100_2_parlour_branch",
    "day100_2_desk_branch",
    "day100_2_reconvergence",
    "day100_3_night_daydream",
    "day100_3_arrival"
  ],
  "affected_setters": [
    "story.set_prologue_found",
    "story.set_prologue_holywell_posture",
    "story.set_prologue_why_write",
    "story.set_run_archetype_seed"
  ],
  "story_board_rows": [
    "Global State Tracking — prologue_found, prologue_why_write, prologue_holywell_posture",
    "Scene Ledger — Day 100 (Prologue / Tutorial)",
    "Spine sequence step 0 — day100_main"
  ],
  "personas": [
    "erotic",
    "class",
    "tension",
    "thematic",
    "mystery"
  ],
  "return_to": {
    "agent": "writers_room",
    "pipeline": "revise-narrative"
  },
  "markdown_brief_path": "main-game/draft/releases/release-1-mvp/day100_narrative_change_brief.md"
}
